{
	"name": "UE5.5 Editor UI (Starship)",
	"version": 1,
	"color": {
		"themes": [{ "id": "dark", "name": "Dark" }],
		"tokens": [
			{ "name": "black", "value": { "dark": "#000000" }, "usage": "EStyleColor::Black. Dividers and shadow strokes, for example the notification border. Not a page ground." },
			{ "name": "background", "value": { "dark": "#151515" }, "usage": "Window and tab-well ground behind panels; the major-tab content area. Text on it is foreground (10.04:1)." },
			{ "name": "title", "value": { "dark": "#151515" }, "usage": "Tab well fill under window chrome (SDockingTabStack.cpp:1234) and the project badge tint. Text on it is foreground (10.04:1)." },
			{ "name": "window-border", "value": { "dark": "#0f0f0f" }, "usage": "2px outer border stroke of a window." },
			{ "name": "foldout", "value": { "dark": "#0f0f0f" }, "usage": "Ground of progress bar tracks (StarshipCoreStyle.cpp:547)." },
			{ "name": "input", "value": { "dark": "#0f0f0f" }, "usage": "Ground of text boxes, spin boxes, search boxes and slider tracks. Text on it is foreground (10.54:1) or foreground-hover." },
			{ "name": "input-outline", "value": { "dark": "#383838" }, "usage": "1px resting outline of an input. Contrast against panel is 1.32:1, below the 3:1 floor for a control border; this is the source value." },
			{ "name": "recessed", "value": { "dark": "#1a1a1a" }, "usage": "Wells set below a panel: window background, separators, log text boxes. Text on it is foreground." },
			{ "name": "panel", "value": { "dark": "#242424" }, "usage": "Standard panel ground: dock tab content, details body, tooltips' neighbours, expandable areas. Text on it is foreground (8.53:1)." },
			{ "name": "header", "value": { "dark": "#2f2f2f" }, "usage": "Table headers, category headers, unchecked filter buttons. Text on it is foreground-header (8.00:1)." },
			{ "name": "dropdown", "value": { "dark": "#383838" }, "usage": "Ground of dropdown buttons and tooltips. Text on it is foreground (6.44:1) or foreground-hover (11.73:1)." },
			{ "name": "dropdown-outline", "value": { "dark": "#4c4c4c" }, "usage": "1px outline of dropdowns and tooltips. Contrast against panel is 1.81:1, below the 3:1 floor for a control border; this is the source value." },
			{ "name": "hover", "value": { "dark": "#575757" }, "usage": "Hovered button ground, resting scrollbar thumb and hover input outline. Pair it with foreground-hover (7.23:1); foreground on it is only 3.97:1." },
			{ "name": "hover-2", "value": { "dark": "#808080" }, "usage": "Hovered or dragged scrollbar thumb. Never a text ground." },
			{ "name": "white", "value": { "dark": "#ffffff" }, "usage": "Pure white: app logo and text on a primary fill." },
			{ "name": "white-25", "value": { "dark": "#ffffff40" }, "usage": "25 percent white overlay for subtle lifts over any ground." },
			{ "name": "highlight", "value": { "dark": "#0070e0" }, "usage": "Text selection background and highlight fills. Same value as primary." },
			{ "name": "primary", "value": { "dark": "#0070e0" }, "usage": "Primary button fill, active tab accents, checked toggles, focus ring. White text on it is 4.78:1." },
			{ "name": "primary-hover", "value": { "dark": "#0e86ff" }, "usage": "Hovered primary fill. White text on it is 3.58:1, below 4.5:1 for small text; this is the source value." },
			{ "name": "primary-press", "value": { "dark": "#0050a0" }, "usage": "Pressed primary fill. White text on it is 7.91:1." },
			{ "name": "secondary", "value": { "dark": "#383838" }, "usage": "Secondary button fill, splitter highlight, filter chip ground. Text on it is foreground (6.44:1)." },
			{ "name": "foreground", "value": { "dark": "#c0c0c0" }, "usage": "Default text and icon colour on panel, background, header, input, dropdown and recessed grounds." },
			{ "name": "foreground-hover", "value": { "dark": "#ffffff" }, "usage": "Text and icon colour while hovered, pressed or selected. Use on hover, primary and select-inactive grounds." },
			{ "name": "foreground-inverted", "value": { "dark": "{input}" }, "usage": "Dark text on a light fill. Alias of input; 10.54:1 on foreground." },
			{ "name": "foreground-header", "value": { "dark": "#c8c8c8" }, "usage": "Text on a header ground (8.00:1)." },
			{ "name": "select", "value": { "dark": "{primary}" }, "usage": "Selected row ground in the focused view. White text on it is 4.78:1." },
			{ "name": "select-inactive", "value": { "dark": "#40576f" }, "usage": "Selected row ground when the view has no focus. Use foreground-hover on it (7.47:1); foreground is only 4.11:1." },
			{ "name": "select-parent", "value": { "dark": "#2c323a" }, "usage": "Tint on a collapsed row that contains the selection. Text on it is foreground (7.11:1)." },
			{ "name": "select-hover", "value": { "dark": "{panel}" }, "usage": "Hovered row ground in a tree or list. Same value as panel." },
			{ "name": "notifications", "value": { "dark": "#464b50" }, "usage": "Toast notification ground. Text on it is foreground-hover (8.81:1)." },
			{ "name": "accent-blue", "value": { "dark": "#26bbff" }, "usage": "Named accent. The details panel star icon when on (SDetailsView.cpp:1177). A mark, never a text ground." },
			{ "name": "accent-purple", "value": { "dark": "#a139bf" }, "usage": "Named accent from EStyleColor. A mark, never a text ground." },
			{ "name": "accent-pink", "value": { "dark": "#ff729c" }, "usage": "Named accent from EStyleColor. A mark, never a text ground." },
			{ "name": "accent-red", "value": { "dark": "#ff4040" }, "usage": "Stop button foreground in the play group (StarshipStyle.cpp:5568). Pair with an icon." },
			{ "name": "accent-orange", "value": { "dark": "#fe9b07" }, "usage": "Named accent from EStyleColor. A mark, never a text ground." },
			{ "name": "accent-yellow", "value": { "dark": "#ffdc1a" }, "usage": "Named accent from EStyleColor. A mark, never a text ground." },
			{ "name": "accent-green", "value": { "dark": "#8bc24a" }, "usage": "Play button foreground and the positive-action Add icon (StarshipStyle.cpp:5535, ToolWidgetsStyle.cpp:76); the text-search highlight shape." },
			{ "name": "accent-brown", "value": { "dark": "#804d39" }, "usage": "Named accent from EStyleColor. A mark, never a text ground." },
			{ "name": "accent-black", "value": { "dark": "#242424" }, "usage": "Accent chip in the near-black slot." },
			{ "name": "accent-gray", "value": { "dark": "#808080" }, "usage": "Accent chip in the gray slot." },
			{ "name": "accent-white", "value": { "dark": "#ffffff" }, "usage": "Accent chip in the white slot." },
			{ "name": "accent-folder", "value": { "dark": "#b68f55" }, "usage": "Folder icon colour in the content browser." },
			{ "name": "axis-x", "value": { "dark": "#cb2600" }, "usage": "2px edge bar on the X field of a vector input (SNumericEntryBox.h:813-819, linear value converted to sRGB). Not an FStyleColors entry." },
			{ "name": "axis-y", "value": { "dark": "#67a900" }, "usage": "2px edge bar on the Y field of a vector input (SNumericEntryBox.h:813-819, converted to sRGB)." },
			{ "name": "axis-z", "value": { "dark": "#2c7eed" }, "usage": "2px edge bar on the Z field of a vector input (SNumericEntryBox.h:813-819, converted to sRGB)." },
			{ "name": "warning", "value": { "dark": "#ffb800" }, "usage": "Warning icon and log text on panel (8.95:1). Pair with a word or icon." },
			{ "name": "error", "value": { "dark": "#ef3535" }, "usage": "Error icon and log text on panel (3.87:1, below 4.5:1 for small text; source value). Pair with a word or icon." },
			{ "name": "success", "value": { "dark": "#1fe44b" }, "usage": "Success icon on panel (9.06:1). Pair with a word or icon." }
		]
	},
	"type": {
		"fonts": [],
		"families": {
			"sans": "\"Roboto\", system-ui, sans-serif",
			"condensed": "\"Roboto Condensed\", \"Roboto\", system-ui, sans-serif",
			"mono": "\"Roboto Mono\", ui-monospace, monospace"
		},
		"groups": [
			{
				"name": "Text",
				"family": "sans",
				"styles": [
					{ "name": "normal", "fontSize": "13.333px", "lineHeight": 1.2, "fontWeight": 400, "usage": "Default UI text. Slate Normal = 10pt Regular at 96 DPI." },
					{ "name": "normal-bold", "fontSize": "13.333px", "lineHeight": 1.2, "fontWeight": 700, "usage": "Emphasised labels, dialog titles." },
					{ "name": "normal-italic", "fontSize": "13.333px", "lineHeight": 1.2, "fontWeight": 400, "fontStyle": "italic", "usage": "Secondary labels, such as read-only values." },
					{ "name": "small", "fontSize": "10.667px", "lineHeight": 1.2, "fontWeight": 400, "usage": "Captions, tile labels, status text. Slate Small = 8pt." },
					{ "name": "small-bold", "fontSize": "10.667px", "lineHeight": 1.2, "fontWeight": 700, "usage": "Expandable area titles, section labels." },
					{ "name": "large", "fontSize": "18.667px", "lineHeight": 1.2, "fontWeight": 400, "usage": "Panel headings. Slate Large = 14pt." },
					{ "name": "large-bold", "fontSize": "18.667px", "lineHeight": 1.2, "fontWeight": 700, "usage": "Details panel object name." },
					{ "name": "tooltip", "fontSize": "12px", "lineHeight": 1.2, "fontWeight": 400, "usage": "Tooltip body. Slate ToolTip.Font = 9pt." },
					{ "name": "notification", "fontSize": "16px", "lineHeight": 1.2, "fontWeight": 700, "usage": "Toast title. Slate NotificationList.FontBold = 12pt Bold." }
				]
			},
			{
				"name": "Headings",
				"family": "condensed",
				"styles": [
					{ "name": "heading-medium", "fontSize": "44px", "lineHeight": 1.1, "fontWeight": 700, "usage": "Large splash headings. Slate HeadingMedium = 33pt BoldCondensed." },
					{ "name": "heading-small", "fontSize": "28px", "lineHeight": 1.1, "fontWeight": 700, "usage": "Wizard page titles and dialog headings. Slate HeadingSmall = 21pt BoldCondensed." },
					{ "name": "heading-extra-small", "fontSize": "20px", "lineHeight": 1.1, "fontWeight": 700, "usage": "Compact headings. Slate HeadingExtraSmall = 15pt BoldCondensed." }
				]
			},
			{
				"name": "Monospace",
				"family": "mono",